undermind_id,Topic Match Score,Title,Year,Date,Authors,Abstract,Journal,Citation Count,Citation Velocity,DOI,Link,External IDs,Is Open Access,Open Access Link,Semantic Scholar ID,Relevance Summary
108,0,Financial Literacy and Digital Literacy To Awareness of Investment Scams Among Indonesian College Students,2024,20/08/2024,"Sabi Ode Umar, Z. Dalimunthe","This study explores the influence between financial literacy and digital literacy, on investment sacam awareness among university students in Indonesia. Using a quantitative approach and the Structural Equation Model Partial Least Square (SEM-PLS), data was collected from 288 university students from 38 provinces in Indonesia through an online questionnaire survey. The results of the analysis show that both financial literacy and digital literacy have significant indirect effects on investment scam awareness through the mediation of cybercrime awareness. The findings support the importance of a good understanding of financial literacy and digital literacy in countering the risk of investment scams, especially in today's digital era. However, this study also found differences in the effect of financial literacy on investment scam awareness based on economic and non-economic educational backgrounds, highlighting the importance of considering demographic factors in efforts to increase investment scam awareness among university students. These findings make an important contribution to the understanding of investment fraud prevention efforts and highlight the need for a more inclusive educational approach focusing on financial literacy and digital literacy at the higher education level in Indonesia.",Eduvest - Journal of Universal Studies,1,1.6,10.59188/eduvest.v4i8.1297,https://doi.org/10.59188/eduvest.v4i8.1297,,TRUE,"{'url': 'https://eduvest.greenvest.co.id/index.php/edv/article/download/1297/2601', 'status': 'GOLD'}",03f146bfac2f75196b9eed18b1e0a1bd1d82b84f,
109,0,THE EVOLUTION OF CYBERCRIME LEGISLATION,2024,27/06/2024,Lika Chimchiuri,"The purpose of the article is analyzes the evolution of cybercrime legislation in several jurisdictions, with a focus on how laws are changing to reflect the complexities of cyber threats in a linked digital landscape. Research methods: this study uses a comparative analysis to identify major legislative developments across North America, Europe, Asia, and the rest of the developing world. Results: the fast development of digital technology has fueled the growth of cybercrimes such as hacking, phishing, and online fraud, posing new problems to judicial systems around the world. The study identifies comparable legislative frameworks, such as criminalizing unauthorized access to computer systems, as well as variations in approaches to penalties, jurisdiction, and enforcement roles. The paper goes further into the effectiveness of these laws in discouraging cybercrime, the difficulty of cross-border enforcement, and the delicate balance between crime prevention and individual privacy rights. Discussion: the article is to provide insights into the creation of strong legal frameworks that can keep up with the ever-changing nature of cyber risks by highlighting new trends and best practices. This analysis not only throws light on present legislative measures but also explores the implications for future policymaking in cybercrime prevention and punishment.","Scientific works of National Aviation University. Series: Law Journal ""Air and Space Law""",0,0,10.18372/2307-9061.71.18813,https://doi.org/10.18372/2307-9061.71.18813,,TRUE,"{'url': 'https://doi.org/10.18372/2307-9061.71.18813', 'status': 'GOLD'}",d1ac8f90d4afa72e428ee9182c63d1302e5551a6,
110,0,Catching Cybercriminals: Policing the Internet,1998,01/07/1998,D. Wall,"This article seeks to contribute to the existing debate(s) over the governance of cyberspace by focusing not upon legal frameworks, which have been already been the subject of much good work, but upon the enforcement of law. What is missing from much of the recent debate has been a substantive discussion of some of the practical problems of policing the Internet, such as by whom and how it should be (is being) policed. Such considerations are becoming increasingly important as the inhabitants of cyberspace multiply in number. It is argued that much of the debate over the policing of the Internet has tended to be driven by moral panics. As these panics subside it is becoming clear that there is clearly a confusion in the literature between the potential and actual harms that can be inflicted by cybercrimes. Consequently, we must be wary of reports which exaggerate the extent to which cybercrimes have proliferated, especially when those reports appear to originate from bodies who are currently engaged in th...","International Review of Law, Computers & Technology",38,1.4,10.1080/13600869855397,https://doi.org/10.1080/13600869855397,,FALSE,,1ff73cf3c8a053dcb9a8da210eadb3950f832c2a,
111,0,Cybercrime Attribution: An Eastern European Case Study,2009,,"S. McCombie, J. Pieprzyk, P. Watters","Phishing and related cybercrime is responsible for billions of dollars in losses annually. Gartner reported more than 5 million U.S. consumers lost money to phishing attacks in the 12 months ending in September 2008 (Gartner 2009). This paper asks whether the majority of organised phishing and related cybercrime originates in Eastern Europe rather than elsewhere such as China or the USA. The Russian “Mafiya” in particular has been popularised by the media and entertainment industries to the point where it can be hard to separate fact from fiction but we have endeavoured to look critically at the information available on this area to produce a survey. We take a particular focus on cybercrime from an Australian perspective, as Australia was one of the first places where Phishing attacks against Internet banks were seen. It is suspected these attacks came from Ukrainian spammers. The survey is built from case studies both where individuals from Eastern Europe have been charged with related crimes or unsolved cases where there is some nexus to Eastern Europe. It also uses some earlier work done looking at those early Phishing attacks, archival analysis of Phishing attacks in July 2006 and new work looking at correlation between the Corruption Perception Index, Internet penetration and tertiary education in Russia and the Ukraine. The value of this work is to inform and educate those charged with responding to cybercrime where a large part of the problem originates and try to understand why.",Science & Engineering Faculty,23,1.4,10.4225/75/57B2880840CCF,https://doi.org/10.4225/75/57B2880840CCF,,FALSE,,76fc2e1c7bbc6983c1d0dc5dcd6ca8abaaec0c84,
112,0,"Threats, Effects, and Awareness of Cybercrime: A Survey",2024,06/05/2024,Moulik Singh Arora,"The emergence of the digital age has ushered in unprecedented connectivity and convenience, but it has also brought about a surge in cybercrimes, posing significant challenges to security. Criminals exploit vulnerabilities in cyberspace to access sensitive information, perpetrate fraudulent activities, and undermine trust in online interactions. Despite the pervasive impact of cyber threats on various facets of society, awareness levels among the general populace remain a critical concern. This paper presents findings from a comprehensive survey aimed at assessing public awareness of cybercrimes and cybersecurity measures. The survey, conducted through a structured questionnaire, solicited responses from a diverse demographic sample, encompassing individuals' background information and their perceptions of cyber threats. Participants were queried on their familiarity with prevalent cyber scams, including phishing, email spoofing, lottery scams, credit card frauds, investment scams, vishing frauds, and gaming frauds. Key findings reveal gaps in awareness and understanding of cyber risks, underscoring the need for enhanced education and vigilance. Furthermore, insights into participants' responses regarding their experiences with cybercrimes, including measures taken to address incidents and financial losses incurred, shed light on the real-world impact of cyber threats. In conclusion, this paper emphasizes the importance of proactive measures to safeguard against cybercrimes and offers recommendations for bolstering cybersecurity awareness and resilience in the digital age. Key Words: Cybercrime, Scams, threats, Analysis, Awareness.",INTERANTIONAL JOURNAL OF SCIENTIFIC RESEARCH IN ENGINEERING AND MANAGEMENT,1,1.1,10.55041/ijsrem32833,https://doi.org/10.55041/ijsrem32833,,TRUE,"{'url': 'https://ijsrem.com/download/threats-effects-and-awareness-of-cybercrime-a-survey/?wpdmdl=32966&refresh=665c4d16e21261717325078', 'status': 'GOLD'}",18274ea7e7f6446200eb29692e09bf4be8b8e997,
113,0,The Simple Economics of Cybercrimes,2006,,N. Kshetri,"The characteristics of cybercriminals, cybercrime victims, and law enforcement agencies have a reinforcing effect on each other, leading to a vicious circle of cybercrime. In this article, the author assessed the cost-benefit structure of cybercriminals. From the potential victims' perspectives, an economic analysis can help explain the optimum investment necessary as well as the measures required to prevent hackers from cracking into their computer networks. The analysis from the cybercriminal's viewpoint also provides insight into factors that might encourage and energize his or her behavior.",LSN: Criminal Law (Public Law) (Topic),145,7.5,10.1109/MSP.2006.27,https://doi.org/10.1109/MSP.2006.27,,TRUE,"{'url': 'http://libres.uncg.edu/ir/uncg/f/N_Kshetri_Simple_2006.pdf', 'status': 'GOLD'}",0ac847d8089d5849b12101c731f6b5593f07c037,
114,0,The Internet as a Conduit for Criminal Activity,2015,21/10/2015,D. Wall,"While there appears to be a common view that the Internet has had a major impact upon criminality, there is much less consensus as to what that impact has been. Many sources make claims about the prevalence of cybercrimes (networked computer crime) without clarifying what is precisely the issue at hand. Indeed, when so-called cases of cybercrime come to court they often have the familiar ring of the 'traditional' rather than the 'cyber' about them. Fraud, pornography, paedophilia, etc., are already covered by substantive areas of law in most jurisdictions. Even more confusing is the gap between the many hundreds of thousands of estimated incidents and the relatively small number of known prosecutions - which questions the early predictions that cybercrimes, unless checked, could effectively bring criminals into every home. In fact, the confusion has led some authors to question whether or not there are indeed such things as cybercrimes (Brenner, 2001:1). Others, have questioned whether cybercrimes are actually categories of crime in need of new theory or whether they are better understood by existing theories (Jones, 2003:98). These contrasting viewpoints expose a large gap in our understanding and beg a number of questions. Are, for example, our concerns about cybercrime driven solely by the media sensitisation of one or two novel events and effectively fabricated into a crime wave. Or are the dramatic news stories the product of information sources created by the cyber-security industry which has a vested interest in sensationalising cybercrimes. Alternatively, could it simply be the case that the criminal justice processes are woefully inefficient at bringing wrongdoers to justice. There again, are we perhaps looking at an entirely new phenomena through the wrong lens?",,90,9.5,10.4135/9781452225708.n4,https://doi.org/10.4135/9781452225708.n4,,FALSE,,e457e81e4db1a94fd9164dfce8c6ddbd959413ca,
115,0,INFORMATION CRIMES AND INVESTIGATION CHALLENGE COMBATING INFORMATION CRIMES; A MULTIDIMENSIONAL APPROACH TO ADDRESSING INVESTIGATION CHALLENGES IN THE ERA OF DIGITAL ADVANCEMENT,2024,29/11/2024,Prusha Qalandar Hussein,"In our increasingly digitized world, information crimes have emerged as a significant threat, encompassing a wide range of unlawful activities such as hacking, identity theft, and cyber espionage. This study explores the landscape of information crimes and the challenges faced by investigators in addressing and mitigating these offenses. The first aspect of this study examines the diverse realm of information crimes, providing an overview of the types of offenses that fall under this category. From financial fraud to data breaches, the spectrum of information crimes is vast, posing risks to individuals, businesses, and even nations. Understanding the nature and evolution of these crimes is crucial for developing effective investigation strategies and procedures. The second focus of this study is on the challenges faced by investigators when tackling information crimes. The dynamic and borderless nature of the digital realm presents unique obstacles, including issues related to jurisdiction, attribution, and the rapidly evolving tactics employed by cybercriminals.

 Additionally, the study sheds light on the technological complexities that investigators face, such as encryption and anonymization tools that perpetrators exploit to conceal their activities. To address these challenges, the study suggests the implementation of multidimensional and collaborative approaches. International cooperation among law enforcement agencies, private sector entities, and cybersecurity experts is emphasized. The study also seeks continuous training and skill development for investigators to stay abreast of technological advancements. In conclusion, this paper tries to underscore the urgency of enhancing global efforts to combat information crimes. By comprehensively understanding the landscape of these offenses and addressing the specific challenges faced by investigators, we can better equip ourselves to safeguard the integrity of information in our interconnected world.",ZANKO Journal of Law and Politics,0,0,10.21271/zjlp.22.sp.23,https://doi.org/10.21271/zjlp.22.sp.23,,FALSE,,6b7885a35cd120e19e6eed1bdc3df8b5edd99284,
116,0,Victimological aspects of countering internet crime: State and local government practices,2024,05/03/2024,"Mamasaly Arstanbekov, Nurman Seidakmatov, Marat Tatenov, Baktygul Kanybekova, Bakyt D. Kakeshov","Globalisation is a reason for increasing levels of anxiety, physical fatigue, and psychological problems, which weakens the ability of people to resist encroachment on themselves, especially in the Internet environment – the dominant sphere for communication. The study aims to identify the vectors of interaction between the state and potential victims of crime on the Internet by analysing the activities of the subjects of the direction in countries with different scientific and technical potentials. The study employed statistical methods to collect qualitative and quantitative indicators of the issue under consideration, as well as comparative analysis to compare the elements of state policy in the field of combating cybercrime. The intensity of crimes committed with the help of Internet tools is growing every year and it is primarily due to the growth of opportunities to perform various financial, social and other types of interaction in the online space. However, there is a direct correlation between the number of cybercrimes and the level of scientific and technological development of a country. According to the Global Innovation Index, some of the most innovatively developed countries are the United States of America, the United Kingdom and Japan, where the intensity of scientific progress is several times higher than in less developed countries, for example, in the Central Asian region. The role and place of state bodies concerning the prevention of Internet crime is extremely difficult to overestimate because it is the central and local government that has a leading position in the development of preventive measures to prevent and minimise the phenomenon of victimisation of society in the Internet space. The distinction and understanding of the types and directions of crimes in the online environment is necessary to create an effective mechanism to combat such crimes and to develop effective tools to inculcate a healthy lifestyle to prevent the development of victimisation traits in a person. The results of the work can be used as a practical basis for further research on the topic – development of state strategies to combat cybercrime",Social Legal Studios,1,0.9,10.32518/sals1.2024.221,https://doi.org/10.32518/sals1.2024.221,,TRUE,"{'url': 'https://sls-journal.com.ua/web/uploads/pdf/Social_and_Legal_Studios_Vol.7_No.1_2024-221-234.pdf', 'status': 'GOLD'}",d1e2f53fe90d1f0d7b2c85727b5562d9933f811b,
117,0,A Comprehensive Quality Evaluation of Security and Privacy Advice on the Web,2020,,"Elissa M. Redmiles, N. Warford, Amritha Jayanti, Aravind Koneru, Sean Kross, Miraida Morales, Rock Stevens, Michelle L. Mazurek",,,116,22.1,,https://www.semanticscholar.org/paper/0a7f47a8937fdb0e18cb61887085d9021695c15d,,FALSE,,0a7f47a8937fdb0e18cb61887085d9021695c15d,
118,0,Identity crime and misuse in Australia: Results of the 2016 online survey,2018,24/05/2018,"Russell Smith, P. Jorna","Identity crime involving the misuse of personal information affects hundreds of thousands of Australians each year—individuals, businesses and governments alike. Through large-scale annual surveys, the Australian Institute of Criminology has examined respondents’ experiences of victimisation over their lifetime and during the preceding 12 months, as well as their perceptions of the risk of identity crime in the ensuing 12 months. The latest survey, undertaken in May 2016, covered just under 10,000 respondents. Findings from the survey confirm that criminal misuse of personal information continues to occur in Australia. Around 20 percent of respondents have had their personal information misused over their lifetime, with between eight and nine percent experiencing misuse in the 12 months prior to completing the survey. Identity crime is one of the most prevalent forms of criminal activity in Australia and remains a persistent concern for many Australians. Survey results should assist those designing awareness programs and prevention initiatives by: indicating those who are more likely to be victims of identity crime; and providing advice on how to seek help and report misuse of personal information.",,4,0.6,10.52922/sr228798,https://doi.org/10.52922/sr228798,,FALSE,,8709b3d726f42d4dabe1264ea27d601d252c27b4,
119,0,Policing Cybercrimes: Situating the Public Police in Networks of Security within Cyberspace,2007,01/05/2007,D. Wall,"The Internet and the criminal behaviour it transforms (cybercrime) pose considerable challenges for order maintenance and law enforcement because Internet‐related offending takes place within a global context while crime tends to be nationally defined. Policing cybercrime is made all the more complex by the very nature of policing and security being networked and nodal and also because within this framework the public police play only a small part in the policing of the Internet. In this paper it is argued that the future of the public police role in policing the Internet is more than simply acquiring new knowledge and capacity, but it is about forging new relationships with the other nodes within the networks of Internet security. These relationships require a range of transformations to take place in order to enhance the effectiveness and legitimacy of the nodal architecture. It will then be argued that some of the contradictions faced by ‘the police’ are being reconciled by the gradual reconstitution of a neo‐Peelian paradigm across a global span, which brings with it a range of instrumental and normative challenges.",Police Practice and Research,135,7.5,10.1080/15614260701377729,https://doi.org/10.1080/15614260701377729,,FALSE,,3d1cec772dc38646e726d3d9c8647a9c3c3fb505,
120,0,Brief Study of Cybercrime on an Internet,2021,04/06/2021,"D. Chudasama, R. Deora","Cybercrime is a serious challenge to society and is harmful to the individuals who become victims. This research paper engages analysis of the cybercrimes that target individuals on the internet and also examines the motivation of criminals that perform such attacks which include (e. g phishing, scams), online harassment, identity theft, malware, hacking and denial-of-service crimes. Cybercrime is a threat to today’s internet-dependent society and is a huge growing problem. By research, it is found that people are using online banking, online shopping and online social networking. Digital technology provides benefits and it provides a rich environment for criminal activity to steal an identity to the theft of classified government information, also known as hacking. A few short examples include buying and selling illegal software and malware, hacking of servers, corrupting systems that could cost billions to individuals, organizations, and government. Cybercrime refers to any crime performed using a computer or an electronic device, mainly through the Internet. As the Internet has many opportunities to consume and access information. Cyber-attacks have mainly caused damage to banking using a credit card and payment scams. Remember, while working within a business, each person has to take personal responsibility for ensuring cybersecurity. You have to prioritize risks that are likely to affect and team up to create the strongest defence against cyberattacks. The study identified security measures are required as well as knowledge of the potential dangers of the Internet. Various steps are taken to slow down attacks but unfortunately are not able to achieve success. The reasons for cyber-attacks, 1.Countries having weak cyber securities, 2. Criminals use new technologies to attack, 3. Cybercrime with business schemes. Every human being is connected by using the internet and it makes the world small. Awareness should be spread regarding cyber-crimes and strict punishments should be imposed on cyber criminals so that criminals leave the idea to do any crime. It ought to guarantee that laws shaped should be followed appropriately.",,18,4.7,10.37591/JOCES.V11I1.812,https://doi.org/10.37591/JOCES.V11I1.812,,FALSE,,31588025d9d4c730b03a3f0d88974f4655cb6db9,
121,0,Cybercrime and The Social Media,2023,15/01/2023,Mohammad Almutasim Bellah Alhamed Alduihi,"In this research, each of the electronic crimes will be analyzed in an attempt to reduce the dangerous effects that they entail, and to clarify their true meaning. A quantitative study was conducted based on a questionnaire, Survey on Cybercrime via Social Media which contains ten questions, with each other question having a measurable scale that was applied to the participants. The survey takes into account the different methods of defrauding innocent victims as well as the number of hours people spend on the internet and the different social media they use. The results showed that 70% of people spend more than 2 hours online and 60% belong to more than 5 social media platforms and 90% of them tried to cheat in a year and 60% of people have lost their money. Cybercrime was noted to be the most common. Mobile phone fraud represented 60% compared to inheritance fraud which represented 10% and fictitious tax refund of 40%. It was also found through the research that 73% of people did not inform the authorities, as 88% prefer not to report even when they suspected that they have been deceived, and 76% of them have seen and heard advertisements about cybercrime. It was also found that 62% are not interested in victims exposed to cybercrime. These results was enough for countries to enact laws and legislation that limit these crimes and intensify the punishment for the perpetrators, as well as educating societies about their danger to avoid them.",ARID International Journal of Informetrics,0,0,10.36772/arid.aijisc.2023.462,https://doi.org/10.36772/arid.aijisc.2023.462,,TRUE,"{'url': 'https://portal.arid.my/Publications/f0e70a8e-90fe-4e76-a2d8-64a46376f225.pdf', 'status': 'GOLD'}",34ef4b9b4a073bc2b6c3df10397a32c378479762,
122,0,Analysis of eCrime in Crowd-sourced Labor Markets: Mechanical Turk vs. Freelancer,2012,,"Vaibhav Garg, L. Camp, Chris Kanich",,,16,1.2,10.1007/978-3-642-39498-0_13,https://doi.org/10.1007/978-3-642-39498-0_13,,FALSE,,ce28c448613e71a9aec886566bb3f7eea543c6f9,
123,0,CYBERCRIME AT THE PRESENT STAGE AND THE ROLE OF VICTIMOLOGICAL PREVENTION IN HER WARNING,2024,09/08/2024,Elena Kleschina,"The article examines the state and trends of cybercrime at the present stage. It is emphasized that, given the growth and variability of cybercrime, victimological prevention is important in its prevention. Victimological prevention is defined as a set of social and legal measures to protect individuals who are more likely to become victims of unlawful attacks. In recent years, during the period of the growth of cybercrime, significant experience has been accumulated in conducting general victimological prevention aimed at informing the population of the country about new criminal threats in the infor-mation space, ways of committing cybercrimes. At the same time, significant importance should be attached not only to general, but also to individual victimological prevention, the potential of which is not fully realized",VESTNIK ADVANCED TRAINING INSTITUTE OF THE MIA OF RUSSIA,0,0,10.29039/2312-7937-2024-2-32-37,https://doi.org/10.29039/2312-7937-2024-2-32-37,,TRUE,"{'url': 'https://vipkmvd.editorum.ru/en/storage/download/164280', 'status': 'GOLD'}",8bfa2d8667951b7ff9d186bcbc8f97b92c3f2429,
