undermind_id,Topic Match Score,Title,Year,Date,Authors,Abstract,Journal,Citation Count,Citation Velocity,DOI,Link,External IDs,Is Open Access,Open Access Link,Semantic Scholar ID,Relevance Summary
60,0,Cybercrime: Understanding the Current State of Literature and Issues Facing CISOs,2024,01/03/2024,"Caitlin C. Ferreira, Andrew Park, Jan H. Kietzmann, Dionysios S. Demetis, Andrew Flostrand, Ian McCarthy, Leyland F. Pitt, Amir Dabirian, Amir Dabirian","The meteoric rise in cybercrime in recent years has resulted in renewed efforts to stem the potential negative effects of these nefarious activities. In this context, the role of the chief information security officer (CISO) has become one of strategic importance, safeguarding the integrity of the organization’s digital assets. Given the economic impact of cybercrime, it has become critically important to understand the cybercrime-related issues that organizations face. We sought to identify these issues by conducting a bibliographic analysis of cybercrime research. The results identified the most prolific and impactful authors, journals, and countries of publication, the most influential articles, and trends in the literature on cybercrime. The research suggests that interest in the field is wide-reaching with the growth in publications stemming from diverse academic disciplines and geographies. The identified trends represent critical knowledge areas for the CISO that are likely to continue the expansion of the field.",IT Professional,0,0,10.1109/MITP.2024.3375571,https://doi.org/10.1109/MITP.2024.3375571,,TRUE,"{'url': 'https://hull-repository.worktribe.com/preview/4700709/Info%20Professional%20Manuscript%20with%20author%20details.pdf', 'status': 'GOLD'}",2d587d49b0a096f93840ef70c34dc2441165dce3,
61,0,"Determinants of reporting cybercrime: A comparison between identity theft, consumer fraud, and hacking",2019,01/07/2019,"S. V. D. van de Weijer, R. Leukfeldt, W. Bernasco","Although the prevalence of cybercrime has increased rapidly, most victims do not report these offenses to the police. This is the first study that compares associations between victim characteristics and crime reporting behavior for traditional crimes versus cybercrimes. Data from four waves of a Dutch cross-sectional population survey are used (N = 97,186 victims). Results show that cybercrimes are among the least reported types of crime. Moreover, the determinants of crime reporting differ between traditional crimes and cybercrimes, between different types of cybercrime (that is, identity theft, consumer fraud, hacking), and between reporting cybercrimes to the police and to other organizations. Implications for future research and practice are discussed.",European Journal of Criminology,76,13.2,10.1177/1477370818773610,https://doi.org/10.1177/1477370818773610,,TRUE,"{'url': 'https://research.vu.nl/files/235235644/Determinants_of_reporting_cybercrime.pdf', 'status': 'GOLD'}",c71c7a4d8c3bca16412c1a3d26966045b27e08f6,
62,0,"Reporting cybercrime victimization: determinants, motives, and previous experiences",2020,02/03/2020,"Steve van de Weijer, R. Leukfeldt, S. Zee","PurposeCybercrime rates have increased rapidly during the last couple of decades, resulting in cybercrimes becoming common crimes. However, most victims do not report cybercrimes to the police. Therefore, this study examines reporting cybercrime victimization and provides insights into the role of the police in this process.Design/methodology/approachA sample of 595 individuals was used. All respondents were shown three vignettes about hypothetical cybercrime victimization and were asked to imagine that this situation happened to them. Four crime and reporting characteristics were manipulated across vignettes. Respondents' intentions to report to the police and to other organizations were used as the dependent variables in regression analyses. Four random factors in the vignettes (i.e. type of crime, seriousness of crime, victim–perpetrator relationship, and reporting modality), as well as several characteristics of the respondents were included in the regression models as independent variables.FindingsThe type of cybercrime is the most important predictor for reporting behaviors. Other determinants are: more serious offenses were more often reported and offenses are less often reported in situations where the victim personally knows the perpetrator. Furthermore, there is large discrepancy between intended and actual cybercrime reporting. These findings provide valuable insights into the factors that influence reporting behavior in the real world. Only a fifth of respondents indicated that they would not report cybercrime victimization to the police. This implies that attempts at improving reporting rates should not solely be focused on improving people's attitudes, but also on removing obstacles to turn these attitudes into actions.Originality/valueIn the current study, the authors contribute to the existing literature by asking a large sample from the general population in the Netherlands about both their intended reporting behavior (i.e. a vignette study) and their actual reporting behavior (i.e. self-reports) of victimization of a wide variety of different types of cybercrime. Determinants of both reporting to the police as well as to other organizations are examined. Moreover, respondents are asked about motivations behind their decision to (not) report a cybercrime to the police. Last, people were asked about their past experiences with reporting cybercrime victimization to the police.",Policing: An International Journal,32,6.3,10.1108/pijpsm-07-2019-0122,https://doi.org/10.1108/pijpsm-07-2019-0122,,TRUE,"{'url': 'https://pure.eur.nl/files/48257969/Repub-122573.pdf', 'status': 'GOLD'}",a0f1c5863cda0b081a26f34971039f3f03496de6,
63,0,Routine citizen Internet practices and cyber victimization: a state-wide study in Virginia,2023,03/07/2023,"Randy R. Gainey, Jay Albanese, Tancy Vandecar-Burdin, J. Hawdon, Thomas E. Dearden, Katalin Parti","ABSTRACT Cybercrime has become a major societal concern, and a better understanding OF cybercrime is needed to target and prevent it more effectively, minimize its consequences, and provide support for victims. Research on cybercrime victimization has exploded in the past few years, but much of it relies on convenience samples and is largely descriptive in nature. The research presented here involves the collection of data from a large sample of Virginia households in 2022 (n = 1,206). The data are analyzed to provide a partial test of routine activity theory to better understand fraud and theft via the Internet. The data provide a solid baseline for describing the extent of cyber victimization across the state. Bivariate and multivariate analyses (logistic regressions) show support for routine activity theory and provide important insights for future research. In particular, we find that certain routine Internet activities may better predict unique forms of cybervictimization than others and that length of time on the Internet is not a good indicator of exposure to motivated offenders. Further, protective guardianship mediates the effects of exposure to motivated offenders; thus, efforts to educate the public on best practices are needed. We conclude that to better assess cybercrime, victimization and engagement, better measurement and longitudinal panel data will be needed.",Criminal Justice Studies,0,0,10.1080/1478601X.2023.2254094,https://doi.org/10.1080/1478601X.2023.2254094,,FALSE,,dcab89e08a235a889d5a46a37167ead8a268eaa4,
64,0,Mapping and Measuring Cybercrime,2010,01/06/2010,"Stefan Fafinski, W. Dutton, H. Margetts","The OII forum was organised to facilitate a dialogue between policymakers, police authorities, representatives of the computing industry and leading international academics on issues of mapping and measuring cybercrime. Its primary aims were to inform decision making in the policy area of cybercrime response and to support a more sophisticated rounded understanding of the issues involved. While the forum was not asked to reach a consensus in any area it raised a number of critical issues and points for further research.",eBusiness & eCommerce eJournal,26,1.8,10.2139/ssrn.1694107,https://doi.org/10.2139/ssrn.1694107,,FALSE,,1118675935ff4294fdf74bad16952f0d14dae960,
65,0,Moving from cash to cashless economy: Factors affecting digitalization in Nepal,2024,20/08/2024,Suman Shrestha,"This study examines the factors affecting digitalization in Nepal. A cashless economy is a dependable variable. The selected independent variables are digital payments medium, technology, internet, cybercrime, and security. The primary source of data is used to assess the opinions of the respondents regarding different factors affecting digitalization in Nepal. The study is based on primary data gathered from 121 respondents all over Nepal. To achieve the purpose of the study, a structured questionnaire is prepared. The correlation coefficients and regression models are estimated to test the significance and importance of digitalization in the Nepalese economy. 
The study showed that digital payments medium has a positive impact on the cashless economy. It indicates that an increase in digital payments medium leads toward a cashless economy. Likewise, the result also showed that technology has a positive impact on a cashless economy. It indicates that technological advancement leads toward a cashless economy. The result also revealed that the internet has a positive impact on a cashless economy. It indicates that the fast and secure internet leads towards a cashless economy. Likewise, the study showed that cybercrime has a negative impact on a cashless economy. It indicates that a decrease in cybercrime leads towards a cashless economy. Further, the study showed that security has a positive impact on a cashless economy. It indicates that highly secured network leads toward a cashless economy.",Nepalese Journal of Management,1,1.6,10.3126/njm.v11i2.68830,https://doi.org/10.3126/njm.v11i2.68830,,TRUE,"{'url': 'https://www.nepjol.info/index.php/njm/article/download/68830/52619', 'status': 'GOLD'}",311f4b0874e6f1443c45533758ab31b653497cce,
66,0,Measuring the Influence of Perceived Cybercrime Risk on Online Service Avoidance,2016,01/03/2016,"Markus Riek, Rainer Böhme, T. Moore","Cybercrime is a pervasive threat for today's Internet-dependent society. While the real extent and economic impact is hard to quantify, scientists and officials agree that cybercrime is a huge and still growing problem. A substantial fraction of cybercrime's overall costs to society can be traced to indirect opportunity costs, resulting from unused online services. This paper presents a parsimonious model that builds on technology acceptance research and insights from criminology to identify factors that reduce Internet users' intention to use online services. We hypothesize that avoidance of online banking, online shopping and online social networking is increased by cybercrime victimization and media reports. The effects are mediated by the perceived risk of cybercrime and moderated by the user's confidence online. We test our hypotheses using a structural equation modeling analysis of a representative pan-European sample. Our empirical results confirm the negative impact of perceived risk of cybercrime on the use of all three online service categories and support the role of cybercrime experience as an antecedent of perceived risk of cybercrime. We further show that more confident Internet users perceive less cybercriminal risk and are more likely to use online banking and online shopping, which highlights the importance of consumer education.",IEEE Transactions on Dependable and Secure Computing,62,6.8,10.1109/TDSC.2015.2410795,https://doi.org/10.1109/TDSC.2015.2410795,,FALSE,,d5e4c09d774e374780b5acff2213dbb0756bd29b,
67,0,A Novel Approach for Building Cyber Crime Prediction and Analysis Model using Random Forest,2024,07/11/2024,"Akshaya R, Saravanan C, Divya T. L","According to Indian Cyber Crime Coordination Centre, In May 2024, Around 7,000 cybercrime complaints were registered per day, a jump of 113.7% between 2021–2023 and 60.9% from 2022–2023, and 85% of them were financial online frauds. Cybercrimes can result in significant financial losses, compromise sensitive data, disrupt critical infrastructure, and erode public trust in digital systems. There is a need for analyzing the trends and patterns of cyber crimes in different parts of India. This paper focuses on building a model for analyzing and predicting cyber crimes rate in different parts of India in future. The datasets from NCRB (National Crime Record Bureau), the official Indian government website, are used for data collection. Random forest technique is applied on preprocessing data to build the predictive model and XGBoost is used on huge data for accurate prediction and efficient decision-making. High prediction accuracy for cybercrimes is demonstrated by the evaluation results, providing a solid means of bolstering cyber secure defenses. An 80:20 ratio was chosen to divide the data into training and testing sets since it was shown to be ideal for model accuracy. A number of machine learning models were examined, Random Forest Regressor was selected due to its accuracy and robustness. Metrics for evaluating the model, such as Mean Squared Error (MSE) and R-squared, showed how well the model predicted trends in cybercrime in the future. The HTML, CSS, and JavaScript were used for the good performance of the application's front end to deliver a user-friendly interface for data display and interaction, making the results accessible and useful for stakeholders.",2024 8th International Conference on Computational System and Information Technology for Sustainable Solutions (CSITSS),0,0,10.1109/CSITSS64042.2024.10816938,https://doi.org/10.1109/CSITSS64042.2024.10816938,,FALSE,,ce8bd1c0b74a7021696ceb46ec2f01bf7ec92e27,
68,0,Problems and Promise of Victimization Surveys for Cross‐National Research,2006,01/01/2006,J. Lynch,"In the late 1960s self‐report surveys of criminal victimization were controversial and new. Now, they are common, a mainstay of statistical systems and a familiar research tool. More complex questions have arisen concerning the validity and reliability of victim survey data, including whether they can be used in cross‐national comparisons of crime and criminal justice issues. Victim survey data are sufficiently valid and reliable for use in cross‐national comparisons. Victim surveys can tell us a great deal about crime cross‐nationally that police administrative data cannot. While surveys in principle should be more comparable across nations than police administrative data, in practice this comparability cannot be assumed. Self‐consciously comparative surveys, such as the International Crime Victimization Survey (ICVS) produce more comparable data across nations than nation‐specific surveys do. Nation‐specific surveys produce higher‐quality data on their specific nation than the ICVS does. Steps should be taken to enhance the quality of ICVS data and the cross‐national comparability of nation‐specific surveys.",Crime and Justice,54,2.8,10.1086/502670,https://doi.org/10.1086/502670,,FALSE,,353574c9f77a625ad3c8d94c34122403264219a9,
69,0,2 A Framework for Analysing the Costs of Cybercrime,2012,,"Ross Anderson, Chris Barton, Rainer Böhme, Richard Clayton, M. V. Eeten, Michael Levi, Tyler Moore, Stefan Savage",,Journal Not Provided,0,0,,https://www.semanticscholar.org/paper/ec39249971ffebcb20bcb06d56538e4afa126be0,,FALSE,,ec39249971ffebcb20bcb06d56538e4afa126be0,
70,0,A Qualitative Research on the Impact and Challenges of Cybercrimes,2021,01/07/2021,"Krishna Viraja, Pradnya Purandare","We are in the digital era where we cannot imagine our lives without the Internet. Technology has become an integral part of our daily routine, and with the significant rise in technology, we see huge growth in cybercrimes. The use of information is increasing every day with the advent of more social media platforms that utilize millions of data per second globally. These data include sensitive information such as trade secrets, privacy, and security issues. The number of crimes is increasing day by day, and these cyber crimes can impact an individual, an organization, or even a whole nation. The research study aims to spread awareness about cybercrimes by offering a detailed analysis of the awareness, impact, and challenges to anyone vulnerable to cybercrime. The methodology adopted to study and analyze the impact and challenges caused due to cybercrimes is qualitative research. On a concluding note, the study will present suggestions to overcome the challenges and talk about the research’s future scope.",Journal of Physics: Conference Series,3,0.8,10.1088/1742-6596/1964/4/042004,https://doi.org/10.1088/1742-6596/1964/4/042004,,TRUE,"{'url': 'https://doi.org/10.1088/1742-6596/1964/4/042004', 'status': 'GOLD'}",e6e867d7e10af6af5c22fb820c58f4befb9211cd,
71,0,Identity crime and misuse in Australia: results of the 2019 online survey,2020,27/08/2020,"Christie Franks, Russell Smith","This report presents the findings of the latest survey of identity crime and misuse undertaken by the Australian Institute of Criminology as part of the Australian Government’s National Identity Security Strategy. Identity crime is one of the most prevalent forms of criminal activity in Australia and can have severe and lasting consequences for victims. In 2019, nearly 10,000 people from across Australia were surveyed about their experience of victimisation over their lifetime and during the preceding 12 months. The survey results for 2019 are compared with those of the 2018 identity crime survey. The 2019 survey found 25 percent of respondents had experienced misuse of their personal information at some time during their life, with nearly 12 percent experiencing it in the previous 12 months. Eighty percent of these identity crime victims also reported a financial loss as a result. The average amount lost in 2019 ($3,916) was noticeably larger than in 2018 ($2,234). The results from the 2019 survey will help policymakers raise awareness of identity crime and reduce its impact throughout Australia.",Journal Not Provided,3,0.7,10.52922/sr04732,https://doi.org/10.52922/sr04732,,FALSE,,575bc20825cf6283acb74ca6de476398bd948a08,
72,0,The challenges facing specialist police cyber-crime units: an empirical analysis,2018,20/09/2018,"Diarmaid Harkin, C. Whelan, Lennon Y. C. Chang","ABSTRACT The growing threat of cyber-crime poses significant challenges for police organisations. This paper presents original, empirical research on specialist cyber-crime units in Australia to report on the issues and problems faced by police staff at the frontline of cyber-policing. Using a mix of survey data and in-depth interviewing with supervisors, key investigators, and civilian staff from two specialist cyber-crime units, this paper outlines the priority challenges as identified by members of these units. While staff report generally positive levels of job satisfaction working in the field of cyber-crime, three major themes emerged: (a) the accelerating quantity of the workload as cyber-crime becomes a bigger social problem; (b) the resourcing of the units has not developed commensurate with demand and (c) the level of skills and training within units are insufficient to address the unique nature and growing complexities of policing cyber-crime. Suggestions by staff regarding how to improve this situation are considered.",Police Practice and Research,55,8.4,10.1080/15614263.2018.1507889,https://doi.org/10.1080/15614263.2018.1507889,,FALSE,,7f62f31900d38d346d8467485bfbb63059e13f27,
73,0,Beyond the pretty penny: the Economic Impact of Cybercrime,2017,01/10/2017,"C. Gañán, Michael Ciere, M. V. Eeten","Over the past decade, considerable research effort has been devoted to articulating and measuring the various ways through which cyber crime impacts overall society. The large volume of literature on the topic contains few attempts to produce estimates of the financial impact of specific cyber incidents and little agreement on how to derive such estimates. An important substrata of this literature focuses on placing a monetary value on the costs of cyber crime but little is known about the long-term economic impact to society. In this article, we first assess the shortcomings of existing cost estimates and focus on the relevant issues pertinent to the feasibility of deriving valid and useful estimates beyond cost-benefit analyses. Following a mixed top-down/bottom-up methodology, we propose a theoretical framework to systematically identify the short and long-term impacts of cyber crime both at the agent and societal level. This framework serves as the foundation to assess the economic consequences of cyber crime beyond monetary costs by focusing on the impact on economic growth.",Proceedings of the 2017 New Security Paradigms Workshop,17,2.3,10.1145/3171533.3171535,https://doi.org/10.1145/3171533.3171535,,FALSE,,8c16acd928f2aa106203304c14ab8b8a2f09640c,
74,0,Attacking and Defending Perspective of E-Crime Behavior and Psychology: A Systemic Dynamic Simulation Approach,2009,07/12/2009,"Deng-Yiv Chiu, Chen-Shu Wang, Tien-Tsun Chung","Cybercrime is a worsening problem that can lead to loss of financial and personal information. However, e-crime is particular hard to detect since internet is boundless that make evidence hard to collect. Additionally, compare to others crime issues, e-crime is an emerging crime type thus previous crime theories should be refined and new methods of predicting ecrime should be further developed. In this research, we constructed a system dynamic simulation model from both ecrime attacking and defending side respectively. Various decision variables that related to behavior and psychology perspectives of victim and offender were added to proposed model. Furthermore, the actual e-crime data of Taiwan from Year 2000 to 2008 for cyber fraud (CF) and offend computer usage (OCU) are then further verified the proposed model. As the simulation result demonstrated, the accuracy rate of ecrime predication can be achieved about 80%. Additionally, some interest parameters are also revealed, such as the recidivism rate and report rate of victim were unknown in previous research. Finally, via inference of simulation result, some suggestions are also proposed to reduce potential e-crime behavior.","2009 Fourth International Conference on Innovative Computing, Information and Control (ICICIC)",3,0.2,10.1109/ICICIC.2009.116,https://doi.org/10.1109/ICICIC.2009.116,,FALSE,,dff54fc9f2d068a1f49a994832d20481bde427f3,
75,0,Cybercrime Research,2020,,"J. Barnor, Alfred A. Patterson","Technological advancements have transformed the way people go about their daily lives. However, this development is not without unintended consequences, as cyber-criminals have also devised ways to gain leverage. The authors conducted a literature review on 106 articles across 40 journals to bring to fore cybercrime studies that have been conducted according to the research themes, methodological approaches, level of analysis, geographical focus, and publication outlets. Themes identified in the review were categorized under an existing typology of cybercrime: cyber-trespass, cyber-deception/theft, cyber-pornography and obscenity, and cyber-violence. This review suggested two main directions for future research in terms of socio-technical and theoretical approaches with five research questions. The originality of this review stems from the fact that it is arguably one of the first reviews that have reviewed cybercrime from a holistic perspective.",,1,0.2,10.4018/978-1-7998-2610-1.ch024,https://doi.org/10.4018/978-1-7998-2610-1.ch024,,FALSE,,d0ebb947286156fe2776ddb65b6151a8ad398876,
76,0,Examining a Transnational Problem: An Analysis of Computer Crime Victimization in Eight Countries From 1999 to 2001,2003,01/09/2003,T. Holt,"Policymakers, the media, and governmental agencies suggest that computer crimes are on the rise, and have been for many years. Few countries produce the statistics and information needed to reinforce such claims, making it difficult to understand the scope of this issue. This research estimates the prevalence of computer crime victimization in eight countries, as well as the rates and changes that occur using the world on‐line population and each individual country population for the years 1999 to 2001. This analysis will also discuss the problems inherent in official statistics and current research on computer crimes.",International Journal of Comparative and Applied Criminal Justice,13,0.6,10.1080/01924036.2003.9678709,https://doi.org/10.1080/01924036.2003.9678709,,FALSE,,ca1bcc373085fdf32238435c7f8a915a5cd72867,
