undermind_id,Topic Match Score,Title,Year,Date,Authors,Abstract,Journal,Citation Count,Citation Velocity,DOI,Link,External IDs,Is Open Access,Open Access Link,Semantic Scholar ID,Relevance Summary
27,1.1,Study of Cyber Crimes Using Data Science,2023,,"Ruta Vaidya, Trupti Gaikwad, Snehal Jadhav, Jyoti Malusare","In today’s technological advancements in the digital world cybercrime has caused unprecedented challenges to individuals and organizations. Cybercrime is an acronym used to describe illicit activity where a computer or network serves as the source, tool of the crime. Cybercrime includes advanced unlawful activities like fraud, the trafficking of child pornography and other intellectual property, identity theft, and privacy violations. A rise in data has been correlated with a rise in incidents of data theft. Worldwide, organizations and individuals are increasingly concerned about hacking and system intrusion using various technologies. Data science is the study of data to extract useful business insights. It is a path of interdisciplinary access for analyzing enormous amounts of data that brings together information and techniques from the domains of artificial intelligence, statistics, mathematics, and computer engineering. In this paper, the data has been collected from Indian Government sites and studied for different states and metropolitan cities. Using different data science techniques along with the statistical methods like correlation, hypothesis testing, some conclusions have been drawn for various motives of cybercrimes.",international journal of engineering technology and management sciences,0,0,10.46647/ijetms.2023.v07i05.059,https://doi.org/10.46647/ijetms.2023.v07i05.059,,TRUE,"{'url': 'https://ijetms.in/Vol-7-issue-5/Vol-7-Issue-5-59.pdf', 'status': 'GOLD'}",8035139e891f60fa4e16d0b7e7f00a4fccd7865e,
28,1,A Comprehensive Overview on Cybersecurity: Threats and Attacks,2021,30/06/2021,"S. Preetha, P. Lalasa, R. Pradeepa","In the world of evolving technologies, we are being driven by online transaction, AI technologies and automated processes. With the increased use of technologies in our life, the cybercrimes have amplified. Various new attacks, tools and techniques have been developed which allow the attackers to access more complex and well-managed systems, creating damage and even remain untraceable. The statistics about cyber crime tell that as of 2021 January, google has registered around 2 million phishing websites. In 2019 around 93.6% of observed malware was polymorphic, which means it changes the code continuously to evade detection. According to FBI and internet crime complaint center 2020crime report has doubled compared to 2019. International Data Corporation predicts that global spending on cybersecurity solutions will reach $133.7 billion by 2022 as cyber threats continue to increase. Governments around the world have acknowledged to growing cyber-attacks by providing directions to organizations implementing efficient cybersecurity practices. Cybersecurity protects computer systems and networks from creating damage to hardware and software, information disclosure, theft and from the interference or misdirection of the services they provide. The need to understand different kinds of cybercrime. In order to develop necessary measures against cybercrime, we need to understand different kinds of cybercrime. Our paper gives you an overview of various types of cyber-crime like malware, phishing, zero-day exploit, Advanced Persistent Threat (APT). The study provides an overview to different preventive existing solutions proposal and methods to detect attack. A strong understanding of such attacks would benefit us to be cautious and develop effective solutions.",Regular issue,1,0.3,10.35940/ijitee.h9242.0610821,https://doi.org/10.35940/ijitee.h9242.0610821,,TRUE,"{'url': 'https://doi.org/10.35940/ijitee.h9242.0610821', 'status': 'GOLD'}",b10094aa8c9688dfbafbef12fc0f9eb60c34b2ee,
29,1,International Cyber Governance: Strategies And Practices Against Cybercrime,2024,18/11/2024,"Yongsheng Guan, Isnaini Isnaini, Wenggedes Frensh","This research examines the complexities of cybercrime and the global efforts required to combat it. Highlighting the increasing sophistication of cyber threats, the study emphasizes the critical importance of international cooperation in cyber governance, the necessity of evolving technological solutions, policy frameworks, and effective legal measures. Utilizing a comprehensive literature review, the research defines the scope, selects relevant databases, incorporates reputable reports, evaluates sources for credibility, and meticulously documents findings. This structured approach ensures a thorough understanding of cybercrime complexities and governance measures. Key areas include balancing security and privacy, public-private partnerships, and ongoing vigilance and collaboration to strengthen cyber governance against dynamic threats.",ARBITER: Jurnal Ilmiah Magister Hukum,0,0,10.31289/arbiter.v6i2.5095,https://doi.org/10.31289/arbiter.v6i2.5095,,TRUE,"{'url': 'https://doi.org/10.31289/arbiter.v6i2.5095', 'status': 'GOLD'}",4d2e5307e12541d247f35f9c14e8d185552c19c8,
30,1,Presence-only species distribution models are sensitive to sample prevalence: Evaluating models using spatial prediction stability and accuracy metrics,2020,01/09/2020,"L. Grimmett, R. Whitsed, A. Horta",,Ecological Modelling,48,10.5,10.1016/j.ecolmodel.2020.109194,https://doi.org/10.1016/j.ecolmodel.2020.109194,,FALSE,,3d5047205fd03f1bfa1d66dc280b3b9cfe9512c6,
31,0.9,Cybersecurity and cybercrime: Current trends and threats,2024,01/06/2024,"Aleksandra Kuzior, Inna Tiutiunyk, Anetta Zielińska, Roland Kelemen","The rapid development of digital technologies and their active implementation in all spheres of the economy, on the one hand, contribute to increased control over the activities of economic entities, and on the other hand, create new challenges associated with the dynamic development of cybercrime. The purpose of the article is to analyze the global trends in cybercrime in 2016-2023 (by calculating national levels of cybercrime) and to model the mechanisms of combating it in order to form a global, open and safe cyberspace, protect the population from cyber threats and cyber fraud, increase the effectiveness of financial monitoring procedures and control over transactions in cyberspace. The article presents the dominant directions, evolutionary, temporal and spatial patterns of the development of crime in cyberspace, clustering of the countries, and identification of leaders and outsiders in the field of cybercrime (through visualization density maps based on the construction of self-organized Kohonen maps). The results of the calculations confirm a significant increase in the level of cybercrime in the world since 2016 (in particular, due to the COVID-19 pandemic and active digital transformation). A comparative analysis of the indicator across countries made it possible to distinguish those with the highest rates of cybercrime (Slovenia, Iceland, Moldova, Georgia) and those with a significantly higher level of cyber security (Greece, Belgium, France, Germany).",JOURNAL OF INTERNATIONAL STUDIES,4,4.8,10.14254/2071-8330.2024/17-2/12,https://doi.org/10.14254/2071-8330.2024/17-2/12,,TRUE,"{'url': 'https://jois.eu/files/12_1441_JIS_Tiutiunyk et al.pdf', 'status': 'GOLD'}",d35915d2dfb700e4e0b26d8e45994e938147ab4e,
32,0.8,Investigating and Prosecuting Cyber Crime: Forensic Dependencies and Barriers to Justice,2015,,Cameron Brown,"The primary goal of this paper is to raise awareness regarding legal loopholes and enabling technologies, which facilitate acts of cyber crime. In perusing these avenues of inquiry, the author seeks to identify systemic impediments which obstruct police investigations, prosecutions, and digital forensics interrogations. Existing academic research on this topic has tended to highlight theoretical perspectives when attempting to explain technology aided crime, rather than presenting practical insights from those actually tasked with working cyber crime cases. The author offers a grounded, pragmatic approach based on the in-depth experience gained serving with police task-forces, government agencies, private sector, and international organizations. The secondary objective of this research encourages policy makers to reevaluate strategies for combating the ubiquitous and evolving threat posed by cyber- criminality. Research in this paper has been guided by the firsthand global accounts (via the author's core involvement in the preparation of the Comprehensive Study on Cybercrime (United Nations Office on Drugs and Crime, 2013) and is keenly focused on core issues of concern, as voiced by the international community. Further, a fictional case study is used as a vehicle to stimulate thinking and exemplify key points of reference. In this way, the author invites the reader to contemplate the reality of a cyber crime inquiry and the practical limits of the criminal justice process.",International Journal of Cyber Criminology,103,10,10.5281/ZENODO.22387,https://doi.org/10.5281/ZENODO.22387,,TRUE,"{'url': 'https://zenodo.org/record/22387/files/Brown2015vol9issue1.pdf', 'status': 'GOLD'}",5dd484041b6097b805f968056c0e64726b528996,
33,0.8,Identity crime and misuse in Australia: Results of the 2021 online survey,2021,14/12/2021,"Merran McAlister, C. Franks","This bulletin presents the findings of the latest survey of identity crime and misuse undertaken by the Australian Institute of Criminology as part of the Australian Government’s National Identity Security Strategy. In 2021, 9,956 people across Australia were surveyed about their experience of victimisation over their lifetime and during 2020. Nineteen percent of respondents had experienced misuse of their personal information in their lifetime and seven percent experienced it in the past year—a decline from 2019. Seventy-eight percent of respondents who reported victimisation in the past year experienced a financial loss as a result.",Journal Not Provided,1,0.3,10.52922/sb78467,https://doi.org/10.52922/sb78467,,FALSE,,dbec7bfee714b920da2eb29881d888b59c1dad58,
34,0.7,A survey of cyber crimes,2012,01/04/2012,"Yanping Zhang, Yang Xiao, K. Ghaboosi, Jingyuan Zhang, Hongmei Deng","With the advancement of computer and information technology, cyber crime is now becoming one of the most significant challenges facing law enforcement organizations. Cyber crimes are generally referred as criminal activities that use computers or networks. An understanding of the characteristics and nature of cyber crimes is important in helping research communities find ways to effectively prevent them. Most existing research focuses more on attacks and attack models, including either actual attacks or imaginary/possible attacks over all layers of networks or computers, but there has been less work carried out on a comprehensive survey of cyber crimes. This paper provides a survey of cyber crimes that have actually occurred. First, cyber crimes in the digital world are compared with crimes in the physical world. Then, cyber crimes are categorized according to the roles of computers or networks. Furthermore, we also notice that some cyber crimes are actually traditionally non-cyber crimes that are facilitated by computers or networks. It is surprising that there are so many recurrent cyber crimes. More efforts are needed to protect people from cyber crimes. Copyright © 2011 John Wiley & Sons, Ltd. 
 
(This paper provides a survey of cyber crimes that have actually occurred. First, cyber crimes in the digital world are compared with crimes in the physical world. Then, cyber crimes are categorized according to the roles of computers or networks.)",Secur. Commun. Networks,4,0.3,10.1002/sec.331,https://doi.org/10.1002/sec.331,,FALSE,,24625a7d609d71190b3e4232b676a5212e4308a8,
35,0.7,Pricing the Cost of Cybercrime—A Financial Protection Approach,2018,10/08/2018,"Thomas Poufinas, Nikolaοs Vordonis","Infrastructures, businesses, end-users and services offered in the digitally integrated environment are exposed to a wide range of risks such as denial of service, hacking, phishing, ransomware, viruses, etc. Consequently, along with their physical life, individuals and organizations have to secure their digital life as well. Digital threats may have a major economic impact both on the individuals and the society, through the direct loss of income and/or property or even an indirect reduction of the individuals’ contribution back to the society and the state. The purpose of this paper is to study the effect of cyber-attacks to the economy, to price the associated cost and to recommend possible measures that internet service providers (ISPs) and policy makers can apply in order to mitigate these risks. In order to achieve that, we employ insurance (actuarial) pricing techniques to calculate the cost of cyber-attacks for an individual and for the economy of a country in total. We are therefore at the same time in place to recommend insurance coverage solutions that can assist in protecting the entity of interest from cyber risks. This resembles to the calculation of a risk premium, as the premium is calculated taking into account only the probability of occurrence of a cyber-attack and the interest rate and not any other loadings. In this context, we mimic the pricing of a policy that provides coverage for the cyber-attack, as well as the calculation of the amount that has to be set aside in order to compensate for the one-off economic loss suffered by the individual, as a result of its occurrence. Here lies our contribution to the scientific research in the field of cyber security insurance, as we employ insurance-based actuarial techniques in order to quantify the relevant loss.",Ibusiness,6,0.9,10.4236/IB.2018.103008,https://doi.org/10.4236/IB.2018.103008,,TRUE,"{'url': 'http://www.scirp.org/journal/PaperDownload.aspx?paperID=86679', 'status': 'GOLD'}",779a567284fc999387a7961368592d2fae037d4e,
36,0.5,Mapping the Geography of Cybercrime: A Review of Indices of Digital Offending by Country,2020,01/09/2020,"Jonathan Lusthaus, M. Bruce, Nigel Phair","The acknowledgement that cybercrime offenders are embedded within local contexts presents a broad vector for further study. But research in this area is still in its early days and many topics need to be developed further. Foremost among these is the geography of cybercrime. This endeavour has an important policy contribution to make. For example, if we can determine which countries are producing cybercrime at more significant levels, preventative measures can be specifically targeted to those countries. The first step within such a research agenda must be the development of an index of cybercriminality by country, as this is foundational to identifying hubs of digital offending and the factors driving the emergence of these hubs. This paper is methodological in its contribution, and does not offer its own empirical findings. Instead, it aims to provide some broad foundational thinking for a very challenging research exercise, and it is intended to support later, more refined, efforts to develop indices. It consists of two components. First, it reviews existing attempts to identify and rank cybercrime hotspots. Second, it draws important lessons from these works towards developing a successful index. Some methodological points are made on what the way forward may be for this emerging field, and how a reliable and valid index on cybercriminality could be crafted.",2020 IEEE European Symposium on Security and Privacy Workshops (EuroS&PW),10,2.2,10.1109/EuroSPW51379.2020.00066,https://doi.org/10.1109/EuroSPW51379.2020.00066,,TRUE,"{'url': 'https://ora.ox.ac.uk/objects/uuid:6dceb4b8-74ff-4dc9-b87f-af2ce29a5462/download_file?safe_filename=WACCO_IEEE_Cybercrime_Hotspots_190620.pdf&file_format=pdf&type_of_work=Conference+item', 'status': 'GOLD'}",f1dff025de327b845c47804199c16a5a766398da,
37,0.4,A literature review of financial losses statistics for cyber security and future trend,2022,30/07/2022,"Md Haris Uddin Sharif, Mehmood Ali Mohammed","Cybercrime directs to any criminal activity taken out utilizing computers or the internet. Attackers have chosen strategies such as social engineering, phishing, and malware as part of their cyber-attacks. A cyber-attack can lead to various effects, ranging from stealing individual data to extortion money or losing helpful information. Society and systems depend on critical infrastructures like power plants, hospitals, and financial services companies. This paper analyzes financial losses statistics for cyber security and future trends. The cost of cybercrime prevention is increasing day by day. Financial losses refer to damages to the wealth of an organization. This includes organizational losses, compensation, and legal fees. By financial loss, we mean increased costs or reduced income caused by the threat. We collect data from various datasets and information from sources. After collecting data, we analyze the data and create a different chart to identify the growth of cyber-attacks, cyber security, and cybercrime costs. We analyze global and worldwide cybercrime status. We also investigate state-wise cybercrime and the cyber security status of the United States of America. Our main objective of the analysis is to find out the financial losses and future trends of cybercrime and cyber security. From our study, we noticed that the number of cybercrimes and their management and prevention costs are rapidly increasing in the USA and worldwide.",World Journal of Advanced Research and Reviews,47,17.6,10.30574/wjarr.2022.15.1.0573,https://doi.org/10.30574/wjarr.2022.15.1.0573,,TRUE,"{'url': 'https://wjarr.com/sites/default/files/WJARR-2022-0573.pdf', 'status': 'GOLD'}",0665102c595c228cf6a64f3ded5df005af38b96b,
38,0.4,"Positive externality, increasing returns, and the rise in cybercrimes",2009,01/12/2009,N. Kshetri,"Introduction The meteoric rise in cybercrime has been an issue of pressing concern to our society. According to Federal Bureau of Investigation (FBI), nine out of 10 U.S. companies experienced computer security incidents in 2005 which led to a loss of $67.2 billion. A survey conducted by IBM found that U.S. businesses worry more about cybercrimes than about physical crimes. Internet-related frauds accounted for 46% of consumer complaints made to the Federal Trade Commission (FTC) in 2005. Total losses of Internet fraud victims reporting to FTC increased from $205 million in 2003 to $336 million in 2005. In a July 2007 interview with USA Today, McAfee CEO reported that his company received 3,000--5,000 threat submissions per day from customers and 10% of them were new. This paper offers an economic analysis to explain cybercrimes' escalation. We define cybercrimes as criminal activities in which computers or computer networks are the principal means of committing an offense. Examples include cyber-theft, cyber-trespass, cyber-obscenity, critical infrastructure attacks and cyber-extortions.6 The most notable features of the cybercrime environment include newness, technology and skill-intensiveness, and a high degree of globalization. Factors such as a wide online availability of hacking tools, information sharing in the cyber-criminal community, availability of experienced hackers' help to less skillful criminals and congestion in law enforcement systems produce externality effects within the cyber-criminal community as well as across society and businesses. We focus on three positive or self-reinforcing feedback systems to examine increasing returns in cybercrime related activities. In this article, we first provide an overview of the positive feedback loops that reinforce cyber-criminals' behavior. Then, we describe mechanisms associated with externality in cybercrime related activities.",Communications of the ACM,63,4.1,10.1145/1610252.1610288,https://doi.org/10.1145/1610252.1610288,,TRUE,"{'url': 'http://libres.uncg.edu/ir/uncg/f/N_Kshetri_Positive_2009.pdf', 'status': 'GOLD'}",e3fa0a34e7ba2d4b3d8089e5490c77e1273b73a7,
39,0.3,The Perpetration and Prevention of Cyber Crime: An Analysis of Cyber Terrorism in India,2012,,"Poonam Kumar, S. Mittal","Cyber crime has become an integral part of the transnational threat landscape and conjures up pressing images of nefarious and increasingly complex online activity. More recently, the concept of 'organized crime' has been attributed to cyber criminality. There has been subsequent disagreement and confusion concerning whether such crime is a derivation of traditional organized crime or an evolution of such crime within the online space. This paper analyses the opaque state of affairs which has been exacerbated by the relative lack of clear evidence attesting to and supporting either scenario. Technological advances have always been used to the advantage of the criminal fraternity. The crucial question that remains is whether those advances have merely facilitated the commission of physical crime or whether in fact they have led to the creation of a new wave of traditional, but virtual, organized crime. The paper also explores the behavioral ramifications on cyber crime on the informational value of the internet and its usage in consumer with demographic analysis level of its threat and increasing crime rate thus eroding the attractiveness of internet as a viable marketing channel.",Int. J. Technoethics,5,0.4,10.4018/jte.2012010104,https://doi.org/10.4018/jte.2012010104,,FALSE,,760236d95f11a1c1a4ec9c9044498e4a1857a195,
40,0.2,Cyber policy for monitoring and regulating cyberspace and cyber security measures for combating technologically enhanced crime in South Africa,2024,11/12/2024,C. Ezeji,"Advancements in science and technology has resulted in substantial transformations inside society. The telecommunications sector has established cyberspace, a virtual domain for online communication, data exchange, and digital interactions. This platform enables individuals to interact and cultivate relationships worldwide, fostering a sense of proximity despite geographical separation. Nonetheless, these improvements provide concerns, since there has been an increase in cyber victimisation via cyberspace, the internet, computer networks, and online systems. Criminals are progressively utilising these technologies to perpetrate illicit actions, endangering individuals, governments, organisations, and institutions.This study analyses the evaluation of cyber policies for regulating, monitoring, and supervising cyberspace activities, along with the implementation of cybersecurity measures to address technologically advanced crime. A mixed methods strategy, including qualitative and quantitative methodologies, was employed for data collecting. The research revealed that although cyberspace provides avenues for social contact, idea exchange, information dissemination, commercial transactions, and additional activities, it remains susceptible to cyber threats including ransomware, fraud, warfare, terrorism, trafficking, and breaches of privacy. Formulating cyber regulations to regulate actions in cyberspace is crucial for efficient law enforcement, alongside the establishment of a cybersecurity framework to safeguard critical cyber systems and bolster security protocols across several sectors. To safeguard both the public and private sectors against cybersecurity risks, it is essential to create and execute plans. These tactics encompass the regular evaluation and auditing of security systems, investment in cybersecurity training programs, maintenance of current systems, formulation and rehearsal of incident response plans, and dissemination of information among experts and professionals.",International Journal of Business Ecosystem &amp; Strategy (2687-2293),0,0,10.36096/ijbes.v6i5.670,https://doi.org/10.36096/ijbes.v6i5.670,,TRUE,"{'url': 'https://doi.org/10.36096/ijbes.v6i5.670', 'status': 'GOLD'}",1cbaae577c4703cbe6c165bb525b421d3f52503b,
41,0.2,Routine Activity Theory and the Determinants of High Cybercrime Countries,2012,01/11/2012,Alex Kigerl,"Cybercrime and the threat it creates are growing in its reach, in accordance with similar growth in information technology. Some countries account for more of the variation in cybercrime activity than others, which affects less criminally involved nations as well, considering that cybercrime does not respect national borders over the Internet. Routine activity theory (RAT) has been used to explain cybercrime at the individual level, but not at the national level. Much research has focused on high cybercrime countries, but this research is often conducted by cybersecurity firms and is exclusively descriptive, making no inferences. This research sought to determine what characteristics predict whether a nation is high in either spamming activity or phishing activity. In a sample of 132 countries, it was found that wealthier nations with more Internet users per capita had higher cybercrime activity. Unemployment was also found to interact with Internet users such that the effect of the proportion of Internet users on spam was strongest in nations with higher unemployment. The implications these findings have for policy and suggestions for future research are discussed.",Social Science Computer Review,105,8.5,10.1177/0894439311422689,https://doi.org/10.1177/0894439311422689,,FALSE,,028163e70ee04b0976bea683874de42623d56d3a,
